root@comp3134winter2024:~# tcpdump -n -i eth0
tcpdump: verbose output suppressed, use -v[v]... for full protocol decode
listening on eth0, link-type EN10MB (Ethernet), snapshot length 262144 bytes
22:29:39.654905 IP 165.22.228.255.22 > 99.230.43.173.64099: Flags [P.], seq 3493910828:3493910912, ack 3309656529, win 501, options [nop,nop,TS val 3432179116 ecr 244373261], length 84
22:29:39.655551 IP 165.22.228.255.22 > 99.230.43.173.64099: Flags [P.], seq 84:192, ack 1, win 501, options [nop,nop,TS val 3432179117 ecr 244373261], length 108
22:29:39.655619 IP 165.22.228.255.22 > 99.230.43.173.64099: Flags [P.], seq 192:228, ack 1, win 501, options [nop,nop,TS val 3432179117 ecr 244373261], length 36
22:29:39.655662 IP 165.22.228.255.22 > 99.230.43.173.64099: Flags [P.], seq 228:280, ack 1, win 501, options [nop,nop,TS val 3432179117 ecr 244373261], length 52
22:29:39.655735 IP 165.22.228.255.22 > 99.230.43.173.64099: Flags [P.], seq 280:416, ack 1, win 501, options [nop,nop,TS val 3432179117 ecr 244373261], length 136
22:29:39.655776 IP 165.22.228.255.22 > 99.230.43.173.64099: Flags [P.], seq 416:452, ack 1, win 501, options [nop,nop,TS val 3432179117 ecr 244373261], length 36
22:29:39.669118 IP 99.230.43.173.64099 > 165.22.228.255.22: Flags [.], ack 452, win 10299, options [nop,nop,TS val 244373285 ecr 3432179117], length 0
22:29:39.753909 IP 165.22.228.255.22 > 99.230.43.173.64099: Flags [P.], seq 452:672, ack 1, win 501, options [nop,nop,TS val 3432179215 ecr 244373285], length 220
22:29:39.754023 IP 165.22.228.255.22 > 99.230.43.173.64099: Flags [P.], seq 672:904, ack 1, win 501, options [nop,nop,TS val 3432179215 ecr 244373285], length 232
22:29:39.754072 IP 165.22.228.255.22 > 99.230.43.173.64099: Flags [P.], seq 904:940, ack 1, win 501, options [nop,nop,TS val 3432179215 ecr 244373285], length 36
22:29:39.754184 IP 165.22.228.255.22 > 99.230.43.173.64099: Flags [P.], seq 940:1136, ack 1, win 501, options [nop,nop,TS val 3432179215 ecr 244373285], length 196
22:29:39.754235 IP 165.22.228.255.22 > 99.230.43.173.64099: Flags [P.], seq 1136:1172, ack 1, win 501, options [nop,nop,TS val 3432179215 ecr 244373285], length 36
22:29:39.754302 IP 165.22.228.255.22 > 99.230.43.173.64099: Flags [P.], seq 1172:1368, ack 1, win 501, options [nop,nop,TS val 3432179215 ecr 244373285], length 196
22:29:39.754340 IP 165.22.228.255.22 > 99.230.43.173.64099: Flags [P.], seq 1368:1404, ack 1, win 501, options [nop,nop,TS val 3432179215 ecr 244373285], length 36
22:29:39.754387 IP 165.22.228.255.22 > 99.230.43.173.64099: Flags [P.], seq 1404:1600, ack 1, win 501, options [nop,nop,TS val 3432179215 ecr 244373285], length 196
22:29:39.754422 IP 165.22.228.255.22 > 99.230.43.173.64099: Flags [P.], seq 1600:1636, ack 1, win 501, options [nop,nop,TS val 3432179215 ecr 244373285], length 36
22:29:39.754481 IP 165.22.228.255.22 > 99.230.43.173.64099: Flags [P.], seq 1636:1832, ack 1, win 501, options [nop,nop,TS val 3432179216 ecr 244373285], length 196
22:29:39.754569 IP 165.22.228.255.22 > 99.230.43.173.64099: Flags [P.], seq 1832:1868, ack 1, win 501, options [nop,nop,TS val 3432179216 ecr 244373285], length 36
22:29:39.754619 IP 165.22.228.255.22 > 99.230.43.173.64099: Flags [P.], seq 1868:2056, ack 1, win 501, options [nop,nop,TS val 3432179216 ecr 244373285], length 188
22:29:39.754654 IP 165.22.228.255.22 > 99.230.43.173.64099: Flags [P.], seq 2056:2092, ack 1, win 501, options [nop,nop,TS val 3432179216 ecr 244373285], length 36
22:29:39.770680 IP 99.230.43.173.64099 > 165.22.228.255.22: Flags [.], ack 2092, win 10280, options [nop,nop,TS val 244373384 ecr 3432179216], length 0
22:29:39.857737 IP 165.22.228.255.22 > 99.230.43.173.64099: Flags [P.], seq 2092:2288, ack 1, win 501, options [nop,nop,TS val 3432179319 ecr 244373384], length 196
22:29:39.857825 IP 165.22.228.255.22 > 99.230.43.173.64099: Flags [P.], seq 2288:2324, ack 1, win 501, options [nop,nop,TS val 3432179319 ecr 244373384], length 36
22:29:39.857846 IP 165.22.228.255.22 > 99.230.43.173.64099: Flags [P.], seq 2324:2520, ack 1, win 501, options [nop,nop,TS val 3432179319 ecr 244373384], length 196
22:29:39.857885 IP 165.22.228.255.22 > 99.230.43.173.64099: Flags [P.], seq 2520:2556, ack 1, win 501, options [nop,nop,TS val 3432179319 ecr 244373384], length 36
22:29:39.857929 IP 165.22.228.255.22 > 99.230.43.173.64099: Flags [P.], seq 2556:2752, ack 1, win 501, options [nop,nop,TS val 3432179319 ecr 244373384], length 196
22:29:39.857964 IP 165.22.228.255.22 > 99.230.43.173.64099: Flags [P.], seq 2752:2788, ack 1, win 501, options [nop,nop,TS val 3432179319 ecr 244373384], length 36
22:29:39.858008 IP 165.22.228.255.22 > 99.230.43.173.64099: Flags [P.], seq 2788:2992, ack 1, win 501, options [nop,nop,TS val 3432179319 ecr 244373384], length 204
22:29:39.858062 IP 165.22.228.255.22 > 99.230.43.173.64099: Flags [P.], seq 2992:3028, ack 1, win 501, options [nop,nop,TS val 3432179319 ecr 244373384], length 36
22:29:39.858150 IP 165.22.228.255.22 > 99.230.43.173.64099: Flags [P.], seq 3028:3232, ack 1, win 501, options [nop,nop,TS val 3432179319 ecr 244373384], length 204
22:29:39.858187 IP 165.22.228.255.22 > 99.230.43.173.64099: Flags [P.], seq 3232:3268, ack 1, win 501, options [nop,nop,TS val 3432179319 ecr 244373384], length 36
22:29:39.858233 IP 165.22.228.255.22 > 99.230.43.173.64099: Flags [P.], seq 3268:3472, ack 1, win 501, options [nop,nop,TS val 3432179319 ecr 244373384], length 204
22:29:39.858272 IP 165.22.228.255.22 > 99.230.43.173.64099: Flags [P.], seq 3472:3508, ack 1, win 501, options [nop,nop,TS val 3432179319 ecr 244373384], length 36
22:29:39.858316 IP 165.22.228.255.22 > 99.230.43.173.64099: Flags [P.], seq 3508:3712, ack 1, win 501, options [nop,nop,TS val 3432179319 ecr 244373384], length 204
22:29:39.858352 IP 165.22.228.255.22 > 99.230.43.173.64099: Flags [P.], seq 3712:3748, ack 1, win 501, options [nop,nop,TS val 3432179319 ecr 244373384], length 36
22:29:39.858403 IP 165.22.228.255.22 > 99.230.43.173.64099: Flags [P.], seq 3748:3952, ack 1, win 501, options [nop,nop,TS val 3432179319 ecr 244373384], length 204
22:29:39.858438 IP 165.22.228.255.22 > 99.230.43.173.64099: Flags [P.], seq 3952:3988, ack 1, win 501, options [nop,nop,TS val 3432179319 ecr 244373384], length 36
22:29:39.858487 IP 165.22.228.255.22 > 99.230.43.173.64099: Flags [P.], seq 3988:4192, ack 1, win 501, options [nop,nop,TS val 3432179320 ecr 244373384], length 204
22:29:39.858522 IP 165.22.228.255.22 > 99.230.43.173.64099: Flags [P.], seq 4192:4228, ack 1, win 501, options [nop,nop,TS val 3432179320 ecr 244373384], length 36
22:29:39.858565 IP 165.22.228.255.22 > 99.230.43.173.64099: Flags [P.], seq 4228:4432, ack 1, win 501, options [nop,nop,TS val 3432179320 ecr 244373384], length 204
22:29:39.858600 IP 165.22.228.255.22 > 99.230.43.173.64099: Flags [P.], seq 4432:4468, ack 1, win 501, options [nop,nop,TS val 3432179320 ecr 244373384], length 36
22:29:39.858644 IP 165.22.228.255.22 > 99.230.43.173.64099: Flags [P.], seq 4468:4672, ack 1, win 501, options [nop,nop,TS val 3432179320 ecr 244373384], length 204
22:29:39.858706 IP 165.22.228.255.22 > 99.230.43.173.64099: Flags [P.], seq 4672:4708, ack 1, win 501, options [nop,nop,TS val 3432179320 ecr 244373384], length 36
22:29:39.858718 IP 165.22.228.255.22 > 99.230.43.173.64099: Flags [P.], seq 4708:4912, ack 1, win 501, options [nop,nop,TS val 3432179320 ecr 244373384], length 204
22:29:39.858750 IP 165.22.228.255.22 > 99.230.43.173.64099: Flags [P.], seq 4912:4948, ack 1, win 501, options [nop,nop,TS val 3432179320 ecr 244373384], length 36
22:29:39.858790 IP 165.22.228.255.22 > 99.230.43.173.64099: Flags [P.], seq 4948:5152, ack 1, win 501, options [nop,nop,TS val 3432179320 ecr 244373384], length 204
22:29:39.859126 IP 165.22.228.255.22 > 99.230.43.173.64099: Flags [P.], seq 5152:5188, ack 1, win 501, options [nop,nop,TS val 3432179320 ecr 244373384], length 36
22:29:39.859209 IP 165.22.228.255.22 > 99.230.43.173.64099: Flags [P.], seq 5188:5376, ack 1, win 501, options [nop,nop,TS val 3432179320 ecr 244373384], length 188
22:29:39.859254 IP 165.22.228.255.22 > 99.230.43.173.64099: Flags [P.], seq 5376:5412, ack 1, win 501, options [nop,nop,TS val 3432179320 ecr 244373384], length 36
22:29:39.872924 IP 99.230.43.173.64099 > 165.22.228.255.22: Flags [.], ack 5152, win 10258, options [nop,nop,TS val 244373487 ecr 3432179320], length 0
22:29:39.878649 IP 99.230.43.173.64099 > 165.22.228.255.22: Flags [.], ack 5412, win 10302, options [nop,nop,TS val 244373487 ecr 3432179320], length 0
22:29:39.878650 IP 99.230.43.173.64099 > 165.22.228.255.22: Flags [P.], seq 1:37, ack 5412, win 10306, options [nop,nop,TS val 244373489 ecr 3432179320], length 36
22:29:39.923051 IP 165.22.228.255.22 > 99.230.43.173.64099: Flags [.], ack 37, win 501, options [nop,nop,TS val 3432179384 ecr 244373489], length 0
22:29:39.961763 IP 165.22.228.255.22 > 99.230.43.173.64099: Flags [P.], seq 5412:5616, ack 37, win 501, options [nop,nop,TS val 3432179423 ecr 244373489], length 204
22:29:39.961872 IP 165.22.228.255.22 > 99.230.43.173.64099: Flags [P.], seq 5616:5652, ack 37, win 501, options [nop,nop,TS val 3432179423 ecr 244373489], length 36
22:29:39.961949 IP 165.22.228.255.22 > 99.230.43.173.64099: Flags [P.], seq 5652:5856, ack 37, win 501, options [nop,nop,TS val 3432179423 ecr 244373489], length 204
22:29:39.962018 IP 165.22.228.255.22 > 99.230.43.173.64099: Flags [P.], seq 5856:5892, ack 37, win 501, options [nop,nop,TS val 3432179423 ecr 244373489], length 36
22:29:39.962114 IP 165.22.228.255.22 > 99.230.43.173.64099: Flags [P.], seq 5892:6096, ack 37, win 501, options [nop,nop,TS val 3432179423 ecr 244373489], length 204
22:29:39.962164 IP 165.22.228.255.22 > 99.230.43.173.64099: Flags [P.], seq 6096:6132, ack 37, win 501, options [nop,nop,TS val 3432179423 ecr 244373489], length 36
22:29:39.962225 IP 165.22.228.255.22 > 99.230.43.173.64099: Flags [P.], seq 6132:6336, ack 37, win 501, options [nop,nop,TS val 3432179423 ecr 244373489], length 204
22:29:39.962269 IP 165.22.228.255.22 > 99.230.43.173.64099: Flags [P.], seq 6336:6372, ack 37, win 501, options [nop,nop,TS val 3432179423 ecr 244373489], length 36
22:29:39.962342 IP 165.22.228.255.22 > 99.230.43.173.64099: Flags [P.], seq 6372:6576, ack 37, win 501, options [nop,nop,TS val 3432179423 ecr 244373489], length 204
22:29:39.962390 IP 165.22.228.255.22 > 99.230.43.173.64099: Flags [P.], seq 6576:6612, ack 37, win 501, options [nop,nop,TS val 3432179423 ecr 244373489], length 36
22:29:39.962452 IP 165.22.228.255.22 > 99.230.43.173.64099: Flags [P.], seq 6612:6816, ack 37, win 501, options [nop,nop,TS val 3432179423 ecr 244373489], length 204
22:29:39.962492 IP 165.22.228.255.22 > 99.230.43.173.64099: Flags [P.], seq 6816:6852, ack 37, win 501, options [nop,nop,TS val 3432179424 ecr 244373489], length 36
22:29:39.962558 IP 165.22.228.255.22 > 99.230.43.173.64099: Flags [P.], seq 6852:7056, ack 37, win 501, options [nop,nop,TS val 3432179424 ecr 244373489], length 204
22:29:39.962604 IP 165.22.228.255.22 > 99.230.43.173.64099: Flags [P.], seq 7056:7092, ack 37, win 501, options [nop,nop,TS val 3432179424 ecr 244373489], length 36
22:29:39.962672 IP 165.22.228.255.22 > 99.230.43.173.64099: Flags [P.], seq 7092:7296, ack 37, win 501, options [nop,nop,TS val 3432179424 ecr 244373489], length 204
22:29:39.962715 IP 165.22.228.255.22 > 99.230.43.173.64099: Flags [P.], seq 7296:7332, ack 37, win 501, options [nop,nop,TS val 3432179424 ecr 244373489], length 36
22:29:39.962782 IP 165.22.228.255.22 > 99.230.43.173.64099: Flags [P.], seq 7332:7536, ack 37, win 501, options [nop,nop,TS val 3432179424 ecr 244373489], length 204
22:29:39.962843 IP 165.22.228.255.22 > 99.230.43.173.64099: Flags [P.], seq 7536:7572, ack 37, win 501, options [nop,nop,TS val 3432179424 ecr 244373489], length 36
22:29:39.962908 IP 165.22.228.255.22 > 99.230.43.173.64099: Flags [P.], seq 7572:7776, ack 37, win 501, options [nop,nop,TS val 3432179424 ecr 244373489], length 204
22:29:39.962950 IP 165.22.228.255.22 > 99.230.43.173.64099: Flags [P.], seq 7776:7812, ack 37, win 501, options [nop,nop,TS val 3432179424 ecr 244373489], length 36
22:29:39.963012 IP 165.22.228.255.22 > 99.230.43.173.64099: Flags [P.], seq 7812:8016, ack 37, win 501, options [nop,nop,TS val 3432179424 ecr 244373489], length 204
22:29:39.963059 IP 165.22.228.255.22 > 99.230.43.173.64099: Flags [P.], seq 8016:8052, ack 37, win 501, options [nop,nop,TS val 3432179424 ecr 244373489], length 36
22:29:39.963133 IP 165.22.228.255.22 > 99.230.43.173.64099: Flags [P.], seq 8052:8256, ack 37, win 501, options [nop,nop,TS val 3432179424 ecr 244373489], length 204
22:29:39.963360 IP 165.22.228.255.22 > 99.230.43.173.64099: Flags [P.], seq 8256:8292, ack 37, win 501, options [nop,nop,TS val 3432179424 ecr 244373489], length 36
22:29:39.963453 IP 165.22.228.255.22 > 99.230.43.173.64099: Flags [P.], seq 8292:8496, ack 37, win 501, options [nop,nop,TS val 3432179424 ecr 244373489], length 204
22:29:39.963505 IP 165.22.228.255.22 > 99.230.43.173.64099: Flags [P.], seq 8496:8532, ack 37, win 501, options [nop,nop,TS val 3432179425 ecr 244373489], length 36
22:29:39.963576 IP 165.22.228.255.22 > 99.230.43.173.64099: Flags [P.], seq 8532:8736, ack 37, win 501, options [nop,nop,TS val 3432179425 ecr 244373489], length 204
22:29:39.963620 IP 165.22.228.255.22 > 99.230.43.173.64099: Flags [P.], seq 8736:8772, ack 37, win 501, options [nop,nop,TS val 3432179425 ecr 244373489], length 36
22:29:39.963680 IP 165.22.228.255.22 > 99.230.43.173.64099: Flags [P.], seq 8772:8976, ack 37, win 501, options [nop,nop,TS val 3432179425 ecr 244373489], length 204
22:29:39.963722 IP 165.22.228.255.22 > 99.230.43.173.64099: Flags [P.], seq 8976:9012, ack 37, win 501, options [nop,nop,TS val 3432179425 ecr 244373489], length 36
22:29:39.963782 IP 165.22.228.255.22 > 99.230.43.173.64099: Flags [P.], seq 9012:9216, ack 37, win 501, options [nop,nop,TS val 3432179425 ecr 244373489], length 204
22:29:39.963828 IP 165.22.228.255.22 > 99.230.43.173.64099: Flags [P.], seq 9216:9252, ack 37, win 501, options [nop,nop,TS val 3432179425 ecr 244373489], length 36
22:29:39.963897 IP 165.22.228.255.22 > 99.230.43.173.64099: Flags [P.], seq 9252:9456, ack 37, win 501, options [nop,nop,TS val 3432179425 ecr 244373489], length 204
22:29:39.963944 IP 165.22.228.255.22 > 99.230.43.173.64099: Flags [P.], seq 9456:9492, ack 37, win 501, options [nop,nop,TS val 3432179425 ecr 244373489], length 36
22:29:39.964011 IP 165.22.228.255.22 > 99.230.43.173.64099: Flags [P.], seq 9492:9696, ack 37, win 501, options [nop,nop,TS val 3432179425 ecr 244373489], length 204
22:29:39.964055 IP 165.22.228.255.22 > 99.230.43.173.64099: Flags [P.], seq 9696:9732, ack 37, win 501, options [nop,nop,TS val 3432179425 ecr 244373489], length 36
22:29:39.964124 IP 165.22.228.255.22 > 99.230.43.173.64099: Flags [P.], seq 9732:9936, ack 37, win 501, options [nop,nop,TS val 3432179425 ecr 244373489], length 204
22:29:39.964171 IP 165.22.228.255.22 > 99.230.43.173.64099: Flags [P.], seq 9936:9972, ack 37, win 501, options [nop,nop,TS val 3432179425 ecr 244373489], length 36
22:29:39.964240 IP 165.22.228.255.22 > 99.230.43.173.64099: Flags [P.], seq 9972:10176, ack 37, win 501, options [nop,nop,TS val 3432179425 ecr 244373489], length 204
22:29:39.964290 IP 165.22.228.255.22 > 99.230.43.173.64099: Flags [P.], seq 10176:10212, ack 37, win 501, options [nop,nop,TS val 3432179425 ecr 244373489], length 36
22:29:39.964362 IP 165.22.228.255.22 > 99.230.43.173.64099: Flags [P.], seq 10212:10416, ack 37, win 501, options [nop,nop,TS val 3432179425 ecr 244373489], length 204
22:29:39.964412 IP 165.22.228.255.22 > 99.230.43.173.64099: Flags [P.], seq 10416:10452, ack 37, win 501, options [nop,nop,TS val 3432179425 ecr 244373489], length 36
22:29:39.964474 IP 165.22.228.255.22 > 99.230.43.173.64099: Flags [P.], seq 10452:10656, ack 37, win 501, options [nop,nop,TS val 3432179425 ecr 244373489], length 204
22:29:39.964514 IP 165.22.228.255.22 > 99.230.43.173.64099: Flags [P.], seq 10656:10692, ack 37, win 501, options [nop,nop,TS val 3432179426 ecr 244373489], length 36
22:29:39.964581 IP 165.22.228.255.22 > 99.230.43.173.64099: Flags [P.], seq 10692:10896, ack 37, win 501, options [nop,nop,TS val 3432179426 ecr 244373489], length 204
22:29:39.964626 IP 165.22.228.255.22 > 99.230.43.173.64099: Flags [P.], seq 10896:10932, ack 37, win 501, options [nop,nop,TS val 3432179426 ecr 244373489], length 36
22:29:39.964694 IP 165.22.228.255.22 > 99.230.43.173.64099: Flags [P.], seq 10932:11136, ack 37, win 501, options [nop,nop,TS val 3432179426 ecr 244373489], length 204
22:29:39.964740 IP 165.22.228.255.22 > 99.230.43.173.64099: Flags [P.], seq 11136:11172, ack 37, win 501, options [nop,nop,TS val 3432179426 ecr 244373489], length 36
22:29:39.964806 IP 165.22.228.255.22 > 99.230.43.173.64099: Flags [P.], seq 11172:11376, ack 37, win 501, options [nop,nop,TS val 3432179426 ecr 244373489], length 204
22:29:39.964852 IP 165.22.228.255.22 > 99.230.43.173.64099: Flags [P.], seq 11376:11412, ack 37, win 501, options [nop,nop,TS val 3432179426 ecr 244373489], length 36
22:29:39.965016 IP 165.22.228.255.22 > 99.230.43.173.64099: Flags [P.], seq 11412:11616, ack 37, win 501, options [nop,nop,TS val 3432179426 ecr 244373489], length 204
22:29:39.965067 IP 165.22.228.255.22 > 99.230.43.173.64099: Flags [P.], seq 11616:11652, ack 37, win 501, options [nop,nop,TS val 3432179426 ecr 244373489], length 36
22:29:39.965138 IP 165.22.228.255.22 > 99.230.43.173.64099: Flags [P.], seq 11652:11856, ack 37, win 501, options [nop,nop,TS val 3432179426 ecr 244373489], length 204
22:29:39.965187 IP 165.22.228.255.22 > 99.230.43.173.64099: Flags [P.], seq 11856:11892, ack 37, win 501, options [nop,nop,TS val 3432179426 ecr 244373489], length 36
22:29:39.965258 IP 165.22.228.255.22 > 99.230.43.173.64099: Flags [P.], seq 11892:12096, ack 37, win 501, options [nop,nop,TS val 3432179426 ecr 244373489], length 204
22:29:39.965306 IP 165.22.228.255.22 > 99.230.43.173.64099: Flags [P.], seq 12096:12132, ack 37, win 501, options [nop,nop,TS val 3432179426 ecr 244373489], length 36
22:29:39.965372 IP 165.22.228.255.22 > 99.230.43.173.64099: Flags [P.], seq 12132:12320, ack 37, win 501, options [nop,nop,TS val 3432179426 ecr 244373489], length 188
22:29:39.976846 IP 99.230.43.173.64099 > 165.22.228.255.22: Flags [.], ack 8532, win 10257, options [nop,nop,TS val 244373591 ecr 3432179425], length 0
22:29:39.976926 IP 165.22.228.255.22 > 99.230.43.173.64099: Flags [P.], seq 12320:13044, ack 37, win 501, options [nop,nop,TS val 3432179438 ecr 244373591], length 724
22:29:39.984883 IP 99.230.43.173.64099 > 165.22.228.255.22: Flags [.], ack 11412, win 10261, options [nop,nop,TS val 244373593 ecr 3432179426], length 0
22:29:39.984884 IP 99.230.43.173.64099 > 165.22.228.255.22: Flags [.], ack 13044, win 10294, options [nop,nop,TS val 244373605 ecr 3432179438], length 0
22:29:40.065718 IP 165.22.228.255.22 > 99.230.43.173.64099: Flags [P.], seq 13044:13248, ack 37, win 501, options [nop,nop,TS val 3432179527 ecr 244373605], length 204
22:29:40.065796 IP 165.22.228.255.22 > 99.230.43.173.64099: Flags [P.], seq 13248:13284, ack 37, win 501, options [nop,nop,TS val 3432179527 ecr 244373605], length 36
22:29:40.065845 IP 165.22.228.255.22 > 99.230.43.173.64099: Flags [P.], seq 13284:13488, ack 37, win 501, options [nop,nop,TS val 3432179527 ecr 244373605], length 204
22:29:40.065880 IP 165.22.228.255.22 > 99.230.43.173.64099: Flags [P.], seq 13488:13524, ack 37, win 501, options [nop,nop,TS val 3432179527 ecr 244373605], length 36
22:29:40.065924 IP 165.22.228.255.22 > 99.230.43.173.64099: Flags [P.], seq 13524:13728, ack 37, win 501, options [nop,nop,TS val 3432179527 ecr 244373605], length 204
22:29:40.065960 IP 165.22.228.255.22 > 99.230.43.173.64099: Flags [P.], seq 13728:13764, ack 37, win 501, options [nop,nop,TS val 3432179527 ecr 244373605], length 36
22:29:40.066004 IP 165.22.228.255.22 > 99.230.43.173.64099: Flags [P.], seq 13764:13968, ack 37, win 501, options [nop,nop,TS val 3432179527 ecr 244373605], length 204
22:29:40.066040 IP 165.22.228.255.22 > 99.230.43.173.64099: Flags [P.], seq 13968:14004, ack 37, win 501, options [nop,nop,TS val 3432179527 ecr 244373605], length 36
22:29:40.066124 IP 165.22.228.255.22 > 99.230.43.173.64099: Flags [P.], seq 14004:14208, ack 37, win 501, options [nop,nop,TS val 3432179527 ecr 244373605], length 204
22:29:40.066166 IP 165.22.228.255.22 > 99.230.43.173.64099: Flags [P.], seq 14208:14244, ack 37, win 501, options [nop,nop,TS val 3432179527 ecr 244373605], length 36
22:29:40.066213 IP 165.22.228.255.22 > 99.230.43.173.64099: Flags [P.], seq 14244:14448, ack 37, win 501, options [nop,nop,TS val 3432179527 ecr 244373605], length 204
22:29:40.066248 IP 165.22.228.255.22 > 99.230.43.173.64099: Flags [P.], seq 14448:14484, ack 37, win 501, options [nop,nop,TS val 3432179527 ecr 244373605], length 36
22:29:40.066292 IP 165.22.228.255.22 > 99.230.43.173.64099: Flags [P.], seq 14484:14688, ack 37, win 501, options [nop,nop,TS val 3432179527 ecr 244373605], length 204
22:29:40.066327 IP 165.22.228.255.22 > 99.230.43.173.64099: Flags [P.], seq 14688:14724, ack 37, win 501, options [nop,nop,TS val 3432179527 ecr 244373605], length 36
22:29:40.066370 IP 165.22.228.255.22 > 99.230.43.173.64099: Flags [P.], seq 14724:14928, ack 37, win 501, options [nop,nop,TS val 3432179527 ecr 244373605], length 204
22:29:40.066407 IP 165.22.228.255.22 > 99.230.43.173.64099: Flags [P.], seq 14928:14964, ack 37, win 501, options [nop,nop,TS val 3432179527 ecr 244373605], length 36
22:29:40.066460 IP 165.22.228.255.22 > 99.230.43.173.64099: Flags [P.], seq 14964:15168, ack 37, win 501, options [nop,nop,TS val 3432179527 ecr 244373605], length 204
22:29:40.066497 IP 165.22.228.255.22 > 99.230.43.173.64099: Flags [P.], seq 15168:15204, ack 37, win 501, options [nop,nop,TS val 3432179528 ecr 244373605], length 36
22:29:40.066852 IP 165.22.228.255.22 > 99.230.43.173.64099: Flags [P.], seq 15204:15408, ack 37, win 501, options [nop,nop,TS val 3432179528 ecr 244373605], length 204
22:29:40.066928 IP 165.22.228.255.22 > 99.230.43.173.64099: Flags [P.], seq 15408:15444, ack 37, win 501, options [nop,nop,TS val 3432179528 ecr 244373605], length 36
22:29:40.066977 IP 165.22.228.255.22 > 99.230.43.173.64099: Flags [P.], seq 15444:15648, ack 37, win 501, options [nop,nop,TS val 3432179528 ecr 244373605], length 204
22:29:40.067020 IP 165.22.228.255.22 > 99.230.43.173.64099: Flags [P.], seq 15648:15684, ack 37, win 501, options [nop,nop,TS val 3432179528 ecr 244373605], length 36
22:29:40.067056 IP 165.22.228.255.22 > 99.230.43.173.64099: Flags [P.], seq 15684:15888, ack 37, win 501, options [nop,nop,TS val 3432179528 ecr 244373605], length 204
22:29:40.067094 IP 165.22.228.255.22 > 99.230.43.173.64099: Flags [P.], seq 15888:15924, ack 37, win 501, options [nop,nop,TS val 3432179528 ecr 244373605], length 36
22:29:40.067138 IP 165.22.228.255.22 > 99.230.43.173.64099: Flags [P.], seq 15924:16128, ack 37, win 501, options [nop,nop,TS val 3432179528 ecr 244373605], length 204
22:29:40.067174 IP 165.22.228.255.22 > 99.230.43.173.64099: Flags [P.], seq 16128:16164, ack 37, win 501, options [nop,nop,TS val 3432179528 ecr 244373605], length 36
22:29:40.067216 IP 165.22.228.255.22 > 99.230.43.173.64099: Flags [P.], seq 16164:16368, ack 37, win 501, options [nop,nop,TS val 3432179528 ecr 244373605], length 204
22:29:40.067251 IP 165.22.228.255.22 > 99.230.43.173.64099: Flags [P.], seq 16368:16404, ack 37, win 501, options [nop,nop,TS val 3432179528 ecr 244373605], length 36
22:29:40.067294 IP 165.22.228.255.22 > 99.230.43.173.64099: Flags [P.], seq 16404:16608, ack 37, win 501, options [nop,nop,TS val 3432179528 ecr 244373605], length 204
22:29:40.067329 IP 165.22.228.255.22 > 99.230.43.173.64099: Flags [P.], seq 16608:16644, ack 37, win 501, options [nop,nop,TS val 3432179528 ecr 244373605], length 36
22:29:40.067371 IP 165.22.228.255.22 > 99.230.43.173.64099: Flags [P.], seq 16644:16848, ack 37, win 501, options [nop,nop,TS val 3432179528 ecr 244373605], length 204
22:29:40.067406 IP 165.22.228.255.22 > 99.230.43.173.64099: Flags [P.], seq 16848:16884, ack 37, win 501, options [nop,nop,TS val 3432179528 ecr 244373605], length 36
22:29:40.067448 IP 165.22.228.255.22 > 99.230.43.173.64099: Flags [P.], seq 16884:17088, ack 37, win 501, options [nop,nop,TS val 3432179528 ecr 244373605], length 204
22:29:40.067487 IP 165.22.228.255.22 > 99.230.43.173.64099: Flags [P.], seq 17088:17124, ack 37, win 501, options [nop,nop,TS val 3432179529 ecr 244373605], length 36
22:29:40.067542 IP 165.22.228.255.22 > 99.230.43.173.64099: Flags [P.], seq 17124:17328, ack 37, win 501, options [nop,nop,TS val 3432179529 ecr 244373605], length 204
22:29:40.067584 IP 165.22.228.255.22 > 99.230.43.173.64099: Flags [P.], seq 17328:17364, ack 37, win 501, options [nop,nop,TS val 3432179529 ecr 244373605], length 36
22:29:40.067630 IP 165.22.228.255.22 > 99.230.43.173.64099: Flags [P.], seq 17364:17568, ack 37, win 501, options [nop,nop,TS val 3432179529 ecr 244373605], length 204
22:29:40.067671 IP 165.22.228.255.22 > 99.230.43.173.64099: Flags [P.], seq 17568:17604, ack 37, win 501, options [nop,nop,TS val 3432179529 ecr 244373605], length 36
22:29:40.067705 IP 165.22.228.255.22 > 99.230.43.173.64099: Flags [P.], seq 17604:17808, ack 37, win 501, options [nop,nop,TS val 3432179529 ecr 244373605], length 204
22:29:40.067742 IP 165.22.228.255.22 > 99.230.43.173.64099: Flags [P.], seq 17808:17844, ack 37, win 501, options [nop,nop,TS val 3432179529 ecr 244373605], length 36
22:29:40.067785 IP 165.22.228.255.22 > 99.230.43.173.64099: Flags [P.], seq 17844:18048, ack 37, win 501, options [nop,nop,TS val 3432179529 ecr 244373605], length 204
22:29:40.067820 IP 165.22.228.255.22 > 99.230.43.173.64099: Flags [P.], seq 18048:18084, ack 37, win 501, options [nop,nop,TS val 3432179529 ecr 244373605], length 36
22:29:40.067862 IP 165.22.228.255.22 > 99.230.43.173.64099: Flags [P.], seq 18084:18288, ack 37, win 501, options [nop,nop,TS val 3432179529 ecr 244373605], length 204
22:29:40.067898 IP 165.22.228.255.22 > 99.230.43.173.64099: Flags [P.], seq 18288:18324, ack 37, win 501, options [nop,nop,TS val 3432179529 ecr 244373605], length 36
22:29:40.067940 IP 165.22.228.255.22 > 99.230.43.173.64099: Flags [P.], seq 18324:18528, ack 37, win 501, options [nop,nop,TS val 3432179529 ecr 244373605], length 204
22:29:40.067975 IP 165.22.228.255.22 > 99.230.43.173.64099: Flags [P.], seq 18528:18564, ack 37, win 501, options [nop,nop,TS val 3432179529 ecr 244373605], length 36
22:29:40.068018 IP 165.22.228.255.22 > 99.230.43.173.64099: Flags [P.], seq 18564:18768, ack 37, win 501, options [nop,nop,TS val 3432179529 ecr 244373605], length 204
22:29:40.068054 IP 165.22.228.255.22 > 99.230.43.173.64099: Flags [P.], seq 18768:18804, ack 37, win 501, options [nop,nop,TS val 3432179529 ecr 244373605], length 36
22:29:40.068095 IP 165.22.228.255.22 > 99.230.43.173.64099: Flags [P.], seq 18804:19008, ack 37, win 501, options [nop,nop,TS val 3432179529 ecr 244373605], length 204
22:29:40.068130 IP 165.22.228.255.22 > 99.230.43.173.64099: Flags [P.], seq 19008:19044, ack 37, win 501, options [nop,nop,TS val 3432179529 ecr 244373605], length 36
22:29:40.068173 IP 165.22.228.255.22 > 99.230.43.173.64099: Flags [P.], seq 19044:19248, ack 37, win 501, options [nop,nop,TS val 3432179529 ecr 244373605], length 204
22:29:40.068208 IP 165.22.228.255.22 > 99.230.43.173.64099: Flags [P.], seq 19248:19284, ack 37, win 501, options [nop,nop,TS val 3432179529 ecr 244373605], length 36
22:29:40.068267 IP 165.22.228.255.22 > 99.230.43.173.64099: Flags [P.], seq 19284:19488, ack 37, win 501, options [nop,nop,TS val 3432179529 ecr 244373605], length 204
22:29:40.068301 IP 165.22.228.255.22 > 99.230.43.173.64099: Flags [P.], seq 19488:19524, ack 37, win 501, options [nop,nop,TS val 3432179529 ecr 244373605], length 36
22:29:40.068345 IP 165.22.228.255.22 > 99.230.43.173.64099: Flags [P.], seq 19524:19728, ack 37, win 501, options [nop,nop,TS val 3432179529 ecr 244373605], length 204
22:29:40.068380 IP 165.22.228.255.22 > 99.230.43.173.64099: Flags [P.], seq 19728:19764, ack 37, win 501, options [nop,nop,TS val 3432179529 ecr 244373605], length 36
22:29:40.068423 IP 165.22.228.255.22 > 99.230.43.173.64099: Flags [P.], seq 19764:19968, ack 37, win 501, options [nop,nop,TS val 3432179529 ecr 244373605], length 204
22:29:40.068458 IP 165.22.228.255.22 > 99.230.43.173.64099: Flags [P.], seq 19968:20004, ack 37, win 501, options [nop,nop,TS val 3432179529 ecr 244373605], length 36
22:29:40.068498 IP 165.22.228.255.22 > 99.230.43.173.64099: Flags [P.], seq 20004:20208, ack 37, win 501, options [nop,nop,TS val 3432179530 ecr 244373605], length 204
22:29:40.068571 IP 165.22.228.255.22 > 99.230.43.173.64099: Flags [P.], seq 20208:20448, ack 37, win 501, options [nop,nop,TS val 3432179530 ecr 244373605], length 240
22:29:40.068603 IP 165.22.228.255.22 > 99.230.43.173.64099: Flags [P.], seq 20448:20484, ack 37, win 501, options [nop,nop,TS val 3432179530 ecr 244373605], length 36
22:29:40.068647 IP 165.22.228.255.22 > 99.230.43.173.64099: Flags [P.], seq 20484:20688, ack 37, win 501, options [nop,nop,TS val 3432179530 ecr 244373605], length 204
22:29:40.068719 IP 165.22.228.255.22 > 99.230.43.173.64099: Flags [P.], seq 20688:20928, ack 37, win 501, options [nop,nop,TS val 3432179530 ecr 244373605], length 240
22:29:40.068776 IP 165.22.228.255.22 > 99.230.43.173.64099: Flags [P.], seq 20928:20964, ack 37, win 501, options [nop,nop,TS val 3432179530 ecr 244373605], length 36
22:29:40.068822 IP 165.22.228.255.22 > 99.230.43.173.64099: Flags [P.], seq 20964:21168, ack 37, win 501, options [nop,nop,TS val 3432179530 ecr 244373605], length 204
22:29:40.068928 IP 165.22.228.255.22 > 99.230.43.173.64099: Flags [P.], seq 21168:21444, ack 37, win 501, options [nop,nop,TS val 3432179530 ecr 244373605], length 276
22:29:40.068964 IP 165.22.228.255.22 > 99.230.43.173.64099: Flags [P.], seq 21444:21684, ack 37, win 501, options [nop,nop,TS val 3432179530 ecr 244373605], length 240
22:29:40.069031 IP 165.22.228.255.22 > 99.230.43.173.64099: Flags [P.], seq 21684:21888, ack 37, win 501, options [nop,nop,TS val 3432179530 ecr 244373605], length 204
22:29:40.069167 IP 165.22.228.255.22 > 99.230.43.173.64099: Flags [P.], seq 21888:22092, ack 37, win 501, options [nop,nop,TS val 3432179530 ecr 244373605], length 204
22:29:40.069220 IP 165.22.228.255.22 > 99.230.43.173.64099: Flags [P.], seq 22092:22296, ack 37, win 501, options [nop,nop,TS val 3432179530 ecr 244373605], length 204
22:29:40.069321 IP 165.22.228.255.22 > 99.230.43.173.64099: Flags [P.], seq 22296:22500, ack 37, win 501, options [nop,nop,TS val 3432179530 ecr 244373605], length 204
22:29:40.069425 IP 165.22.228.255.22 > 99.230.43.173.64099: Flags [P.], seq 22500:23040, ack 37, win 501, options [nop,nop,TS val 3432179530 ecr 244373605], length 540
22:29:40.069530 IP 165.22.228.255.22 > 99.230.43.173.64099: Flags [P.], seq 23040:23412, ack 37, win 501, options [nop,nop,TS val 3432179531 ecr 244373605], length 372
22:29:40.069612 IP 165.22.228.255.22 > 99.230.43.173.64099: Flags [P.], seq 23412:23616, ack 37, win 501, options [nop,nop,TS val 3432179531 ecr 244373605], length 204
22:29:40.069679 IP 165.22.228.255.22 > 99.230.43.173.64099: Flags [P.], seq 23616:23820, ack 37, win 501, options [nop,nop,TS val 3432179531 ecr 244373605], length 204
22:29:40.069764 IP 165.22.228.255.22 > 99.230.43.173.64099: Flags [P.], seq 23820:24192, ack 37, win 501, options [nop,nop,TS val 3432179531 ecr 244373605], length 372
22:29:40.069850 IP 165.22.228.255.22 > 99.230.43.173.64099: Flags [P.], seq 24192:24564, ack 37, win 501, options [nop,nop,TS val 3432179531 ecr 244373605], length 372
22:29:40.069917 IP 165.22.228.255.22 > 99.230.43.173.64099: Flags [P.], seq 24564:24768, ack 37, win 501, options [nop,nop,TS val 3432179531 ecr 244373605], length 204
22:29:40.069996 IP 165.22.228.255.22 > 99.230.43.173.64099: Flags [P.], seq 24768:25140, ack 37, win 501, options [nop,nop,TS val 3432179531 ecr 244373605], length 372
22:29:40.070092 IP 165.22.228.255.22 > 99.230.43.173.64099: Flags [P.], seq 25140:25512, ack 37, win 501, options [nop,nop,TS val 3432179531 ecr 244373605], length 372
22:29:40.070211 IP 165.22.228.255.22 > 99.230.43.173.64099: Flags [P.], seq 25512:26044, ack 37, win 501, options [nop,nop,TS val 3432179531 ecr 244373605], length 532
22:29:40.070287 IP 165.22.228.255.22 > 99.230.43.173.64099: Flags [P.], seq 26044:26392, ack 37, win 501, options [nop,nop,TS val 3432179531 ecr 244373605], length 348
22:29:40.070334 IP 165.22.228.255.22 > 99.230.43.173.64099: Flags [P.], seq 26392:26428, ack 37, win 501, options [nop,nop,TS val 3432179531 ecr 244373605], length 36
22:29:40.082513 IP 99.230.43.173.64099 > 165.22.228.255.22: Flags [.], ack 19008, win 10306, options [nop,nop,TS val 244373697 ecr 3432179529], length 0
22:29:40.089109 IP 99.230.43.173.64099 > 165.22.228.255.22: Flags [.], ack 26428, win 10241, options [nop,nop,TS val 244373701 ecr 3432179531], length 0
22:29:40.089110 IP 99.230.43.173.64099 > 165.22.228.255.22: Flags [.], ack 26428, win 10306, options [nop,nop,TS val 244373701 ecr 3432179531], length 0
22:29:40.169695 IP 165.22.228.255.22 > 99.230.43.173.64099: Flags [P.], seq 26428:26632, ack 37, win 501, options [nop,nop,TS val 3432179631 ecr 244373701], length 204
22:29:40.169862 IP 165.22.228.255.22 > 99.230.43.173.64099: Flags [P.], seq 26632:27172, ack 37, win 501, options [nop,nop,TS val 3432179631 ecr 244373701], length 540
22:29:40.169987 IP 165.22.228.255.22 > 99.230.43.173.64099: Flags [P.], seq 27172:27712, ack 37, win 501, options [nop,nop,TS val 3432179631 ecr 244373701], length 540
22:29:40.170155 IP 165.22.228.255.22 > 99.230.43.173.64099: Flags [P.], seq 27712:28084, ack 37, win 501, options [nop,nop,TS val 3432179631 ecr 244373701], length 372
22:29:40.170318 IP 165.22.228.255.22 > 99.230.43.173.64099: Flags [P.], seq 28084:28960, ack 37, win 501, options [nop,nop,TS val 3432179631 ecr 244373701], length 876
22:29:40.170398 IP 165.22.228.255.22 > 99.230.43.173.64099: Flags [P.], seq 28960:29332, ack 37, win 501, options [nop,nop,TS val 3432179631 ecr 244373701], length 372
22:29:40.170473 IP 165.22.228.255.22 > 99.230.43.173.64099: Flags [P.], seq 29332:29704, ack 37, win 501, options [nop,nop,TS val 3432179631 ecr 244373701], length 372
22:29:40.170546 IP 165.22.228.255.22 > 99.230.43.173.64099: Flags [P.], seq 29704:30076, ack 37, win 501, options [nop,nop,TS val 3432179632 ecr 244373701], length 372
22:29:40.170622 IP 165.22.228.255.22 > 99.230.43.173.64099: Flags [P.], seq 30076:30448, ack 37, win 501, options [nop,nop,TS val 3432179632 ecr 244373701], length 372
22:29:40.170696 IP 165.22.228.255.22 > 99.230.43.173.64099: Flags [P.], seq 30448:30820, ack 37, win 501, options [nop,nop,TS val 3432179632 ecr 244373701], length 372
22:29:40.170751 IP 165.22.228.255.22 > 99.230.43.173.64099: Flags [P.], seq 30820:31024, ack 37, win 501, options [nop,nop,TS val 3432179632 ecr 244373701], length 204
22:29:40.170851 IP 165.22.228.255.22 > 99.230.43.173.64099: Flags [P.], seq 31024:31564, ack 37, win 501, options [nop,nop,TS val 3432179632 ecr 244373701], length 540
22:29:40.170924 IP 165.22.228.255.22 > 99.230.43.173.64099: Flags [P.], seq 31564:31936, ack 37, win 501, options [nop,nop,TS val 3432179632 ecr 244373701], length 372
22:29:40.170982 IP 165.22.228.255.22 > 99.230.43.173.64099: Flags [P.], seq 31936:32148, ack 37, win 501, options [nop,nop,TS val 3432179632 ecr 244373701], length 212
22:29:40.171053 IP 165.22.228.255.22 > 99.230.43.173.64099: Flags [P.], seq 32148:32520, ack 37, win 501, options [nop,nop,TS val 3432179632 ecr 244373701], length 372
22:29:40.171127 IP 165.22.228.255.22 > 99.230.43.173.64099: Flags [P.], seq 32520:32892, ack 37, win 501, options [nop,nop,TS val 3432179632 ecr 244373701], length 372
22:29:40.171232 IP 165.22.228.255.22 > 99.230.43.173.64099: Flags [P.], seq 32892:33264, ack 37, win 501, options [nop,nop,TS val 3432179632 ecr 244373701], length 372
22:29:40.171584 IP 165.22.228.255.22 > 99.230.43.173.64099: Flags [P.], seq 33264:33804, ack 37, win 501, options [nop,nop,TS val 3432179633 ecr 244373701], length 540
22:29:40.172082 IP 165.22.228.255.22 > 99.230.43.173.64099: Flags [P.], seq 33804:36704, ack 37, win 501, options [nop,nop,TS val 3432179633 ecr 244373701], length 2900
22:29:40.172252 IP 165.22.228.255.22 > 99.230.43.173.64099: Flags [P.], seq 36704:37412, ack 37, win 501, options [nop,nop,TS val 3432179633 ecr 244373701], length 708
22:29:40.172396 IP 165.22.228.255.22 > 99.230.43.173.64099: Flags [P.], seq 37412:37952, ack 37, win 501, options [nop,nop,TS val 3432179633 ecr 244373701], length 540
22:29:40.172507 IP 165.22.228.255.22 > 99.230.43.173.64099: Flags [P.], seq 37952:38332, ack 37, win 501, options [nop,nop,TS val 3432179634 ecr 244373701], length 380
22:29:40.172627 IP 165.22.228.255.22 > 99.230.43.173.64099: Flags [P.], seq 38332:38872, ack 37, win 501, options [nop,nop,TS val 3432179634 ecr 244373701], length 540
22:29:40.172734 IP 165.22.228.255.22 > 99.230.43.173.64099: Flags [P.], seq 38872:39244, ack 37, win 501, options [nop,nop,TS val 3432179634 ecr 244373701], length 372
22:29:40.172830 IP 165.22.228.255.22 > 99.230.43.173.64099: Flags [P.], seq 39244:39792, ack 37, win 501, options [nop,nop,TS val 3432179634 ecr 244373701], length 548
22:29:40.172908 IP 165.22.228.255.22 > 99.230.43.173.64099: Flags [P.], seq 39792:40164, ack 37, win 501, options [nop,nop,TS val 3432179634 ecr 244373701], length 372
22:29:40.172985 IP 165.22.228.255.22 > 99.230.43.173.64099: Flags [P.], seq 40164:40544, ack 37, win 501, options [nop,nop,TS val 3432179634 ecr 244373701], length 380
22:29:40.173069 IP 165.22.228.255.22 > 99.230.43.173.64099: Flags [P.], seq 40544:40916, ack 37, win 501, options [nop,nop,TS val 3432179634 ecr 244373701], length 372
22:29:40.173178 IP 165.22.228.255.22 > 99.230.43.173.64099: Flags [P.], seq 40916:41456, ack 37, win 501, options [nop,nop,TS val 3432179634 ecr 244373701], length 540
22:29:40.173256 IP 165.22.228.255.22 > 99.230.43.173.64099: Flags [P.], seq 41456:41804, ack 37, win 501, options [nop,nop,TS val 3432179634 ecr 244373701], length 348
22:29:40.173326 IP 165.22.228.255.22 > 99.230.43.173.64099: Flags [P.], seq 41804:41992, ack 37, win 501, options [nop,nop,TS val 3432179634 ecr 244373701], length 188
22:29:40.173389 IP 165.22.228.255.22 > 99.230.43.173.64099: Flags [P.], seq 41992:42028, ack 37, win 501, options [nop,nop,TS val 3432179634 ecr 244373701], length 36
22:29:40.184708 IP 99.230.43.173.64099 > 165.22.228.255.22: Flags [.], ack 41804, win 10172, options [nop,nop,TS val 244373801 ecr 3432179634], length 0
22:29:40.192677 IP 99.230.43.173.64099 > 165.22.228.255.22: Flags [.], ack 42028, win 10302, options [nop,nop,TS val 244373801 ecr 3432179634], length 0
^C
234 packets captured
252 packets received by filter
0 packets dropped by kernel
root@comp3134winter2024:~# 
